{
  "catalog_versions": {
    "vigia": "2026-07-20"
  },
  "intent": "factual",
  "limits": {
    "max_repairs": 2,
    "max_rounds": 1,
    "max_tool_calls": 3
  },
  "plan_id": "pln_c03a1b2c3d4e",
  "schema_version": "1.0",
  "steps": [
    {
      "agent": "agent.vigia",
      "arguments": {
        "texto": "Alcorcón"
      },
      "step_id": "s1",
      "system": "vigia",
      "tool": "site_resolver"
    },
    {
      "agent": "agent.vigia",
      "arguments": {
        "estado": "abierta",
        "metric": "alarmas_abiertas",
        "period": "ahora",
        "site_id": {
          "$ref_fact": "site_id",
          "$ref_step": "s1"
        }
      },
      "depends_on": [
        {
          "step_id": "s1"
        }
      ],
      "step_id": "s2",
      "system": "vigia",
      "tool": "query_metric"
    }
  ],
  "systems": [
    "vigia"
  ]
}
