{
  "catalog_versions": {
    "vigia": "2026-07-20"
  },
  "intent": "analytic",
  "limits": {
    "max_repairs": 2,
    "max_rounds": 3,
    "max_tool_calls": 6
  },
  "plan_id": "pln_b2c3d4e5f6a7",
  "schema_version": "1.0",
  "steps": [
    {
      "agent": "agent.vigia",
      "arguments": {
        "texto": "Getafe"
      },
      "step_id": "s1",
      "system": "vigia",
      "tool": "site_resolver"
    },
    {
      "agent": "agent.vigia",
      "arguments": {
        "compare_to": "periodo_anterior",
        "entity": "site",
        "id": {
          "$ref_fact": "site_id",
          "$ref_step": "s1"
        },
        "period": "mes_actual"
      },
      "depends_on": [
        {
          "step_id": "s1"
        }
      ],
      "step_id": "s2",
      "system": "vigia",
      "tool": "build_dossier"
    }
  ],
  "systems": [
    "vigia"
  ]
}
